{
  "schema": "gamebuddy-action-project/v1",
  "gameId": "stardew",
  "projectVersion": 1,
  "adapter": "./src/project-adapter.mjs",
  "portfolio": "./portfolio.json",
  "toolInventory": "./tool-inventory.json",
  "evidenceRoot": "./artifacts/action-runs",
  "defaultProfileExample": "./profiles/example.json"
}
